{
  "schema_version": "reagent.workspace-sync-plan/v0.1",
  "installation_id": "install-88888888888888888888888888888888",
  "project_id": "project-11111111111111111111111111111111",
  "workspace_id": "workspace-22222222222222222222222222222222",
  "base_manifest_revision": 0,
  "target_manifest_revision": 1,
  "target_manifest_checksum": "sha256:dddddddddddddddddddddddddddddddddddddddddddddddddddddddddddddddd",
  "installed_lock_checksum": null,
  "plan_checksum": "sha256:ffffffffffffffffffffffffffffffffffffffffffffffffffffffffffffffff",
  "state": "PLAN_CREATED",
  "actions": [
    {
      "sequence": 1,
      "action_type": "INSTALL_CAPSULE",
      "subject_id": "capsule-44444444444444444444444444444444",
      "expected_checksum": "sha256:aaaaaaaaaaaaaaaaaaaaaaaaaaaaaaaaaaaaaaaaaaaaaaaaaaaaaaaaaaaaaaaa",
      "archive_size_bytes": 4096,
      "destination_relative_path": "capsules/literature-search-local-experimental/wfi-33333333333333333333333333333333/0.5.0"
    }
  ],
  "created_at": "2026-08-06T12:00:00Z",
  "expires_at": "2026-08-06T12:10:00Z"
}
